{
  "$schema": "https://json-schema.org/draft/2020-12/schema",
  "x-select": ["workshop-item"],
  "title": "Workshop item",
  "description": "One workshop item (WS): a fix, a problem or a piece of recurring maintenance, back-at-base work that is not a mission. Filed by identifier, WS001.json.",
  "type": "object",
  "required": ["kind", "id", "title", "raised", "source", "status"],
  "properties": {
    "kind": {
      "description": "the words workshop-item, which is what chooses this schema",
      "const": "workshop-item"
    },
    "id": {
      "description": "this item's identifier, WS and three digits in the order raised, the same identifier the file is named for",
      "type": "string",
      "pattern": "^WS[0-9]{3}$"
    },
    "title": {
      "description": "the item in one line",
      "type": "string",
      "minLength": 1
    },
    "raised": {
      "description": "the day it was raised, YYYY-MM-DD",
      "type": "string",
      "pattern": "^[0-9]{4}-[0-9]{2}-[0-9]{2}$"
    },
    "source": {
      "description": "where it came from: a seat and session, a review, or the commander",
      "type": "string",
      "minLength": 1
    },
    "status": {
      "description": "where the item stands: open, swept into a mission, fixed or dropped",
      "enum": ["open", "swept", "fixed", "dropped"]
    },
    "recurring": {
      "description": "true for maintenance that comes round again rather than a one-off fix",
      "type": "boolean"
    },
    "swept_into": {
      "description": "the mission the item was swept into, M and three digits; absent otherwise",
      "type": "string",
      "pattern": "^M[0-9]{3}$"
    },
    "resolved": {
      "description": "the date it was fixed or dropped and where, in one line; absent while it is open",
      "type": "string",
      "minLength": 1
    },
    "notes": {
      "description": "anything the one-line title cannot carry",
      "type": "string",
      "minLength": 1
    }
  }
}
