{
  "kind": "workshop-item",
  "id": "WS017",
  "title": "Historical findings from the doctrine record (roster uneven against the model rule, gate G3 without code, cast renamed and split, verification reorganised) are valid for later agent work and were removed from the record on the commander's order; they live in notepad/research-2026-09-18/source/doctrine-and-genesis.md. Sweep into Sp008 when it flies",
  "raised": "2026-09-18",
  "source": "commander, out-advice/CA002.md",
  "status": "open"
}
